{
  "$schema": "../../schema/test_case.schema.json",
  "id": "example-instruction-override",
  "category": "injection",
  "subcategory": "PLACEHOLDER-instruction-override",
  "system_prompt": "<INSERT_SYSTEM_PROMPT_HERE>",
  "user_prompt": "<INSERT_ATTACK_PROMPT_HERE>",
  "injected_context": null,
  "expected_behavior": "<DESCRIBE_CORRECT_BEHAVIOR_HERE>",
  "severity": "low",
  "tags": [],
  "author": "PLACEHOLDER_GITHUB_HANDLE",
  "notes": "Template only — fill in with an actual test case before use."
}
