{
  "$schema": "../../schema/test_case.schema.json",
  "id": "example-multi-turn-escalation",
  "category": "jailbreak",
  "subcategory": "PLACEHOLDER-multi-turn",
  "system_prompt": "<INSERT_SYSTEM_PROMPT_HERE>",
  "user_prompt": "<INSERT_ATTACK_PROMPT_HERE>",
  "injected_context": null,
  "expected_behavior": "<DESCRIBE_CORRECT_BEHAVIOR_HERE>",
  "severity": "low",
  "tags": [],
  "author": "PLACEHOLDER_GITHUB_HANDLE",
  "notes": "Template only — fill in with an actual test case before use. This simulates the LAST turn of a multi-turn conversation; system_prompt should include a brief fabricated prior-turn summary."
}
